Title,Description
Gejala Agoraphobia,"Gejala yang terjadi pada pengidap agoraphobia antara lain:
Detak jantung yang cepat.
Napas yang cepat.
Merasa panas dan berkeringat atau merasa dingin.
Merasa sakit (tidak enak badan).
Mual atau diare.
Nyeri dada.
Gangguan menelan.
Takut akan mati.
Namun secara luas, gejala agoraphobia terklasifikasi menjadi 3 jenis:
1. Gejala fisik
Gejala fisik agoraphobia biasanya hanya terjadi saat pengidap berada dalam situasi atau lingkungan yang menyebabkan kecemasan. Namun, banyak pengidap agoraphobia yang jarang mengalami gejala fisik karena secara menghindari situasi yang membuatnya cemas.
Sebenarnya, gejala fisik agoraphobia mirip dengan serangan panik, yaitu berupa:
Detak jantung cepat.
Pernapasan cepat (hiperventilasi).
Merasa panas dan berkeringat.
Merasa sakit.
Nyeri dada.
Kesulitan menelan.
Diare.
Gemetaran.
Pusing.
Telinga berdenging (tinnitus).
Merasa lemah.
2. Gejala kognitif
Sementara itu gejala kognitif agoraphobia yaitu perasaan atau pikiran yang didapat, tapi tidak selalu terkait dengan gejala fisik. Gejala kognitif agoraphobia mungkin termasuk ketakutan bahwa:
Serangan panik akan membuat kamu terlihat bodoh atau merasa malu di depan orang lain.
Serangan panik akan mengancam jiwa, misalnya, mungkin kamu khawatir jantung akan berhenti atau tidak dapat bernapas.
Kamu tidak akan bisa melarikan diri dari suatu tempat atau situasi jika mengalami serangan panik.
Takut kehilangan kewarasan.
Merasa takut kehilangan kendali di depan umum.
Kamu mungkin gemetar atau tersipu di depan orang.
Takut orang mungkin menatap kamu.
Selain itu, ada juga gejala psikologis yang tidak berhubungan dengan serangan panik, seperti:
Merasa tidak akan bisa berfungsi atau bertahan hidup tanpa bantuan orang lain.
Rasa takut ditinggal sendirian di rumah.
Perasaan umum kecemasan atau ketakutan.
3. Gejala perilaku
Gejala agoraphobia yang berkaitan dengan perilaku meliputi:
Menghindari situasi yang dapat menyebabkan serangan panik, seperti tempat keramaian, angkutan umum, dan antrean.
Berada di rumah, tidak bisa meninggalkan rumah untuk waktu yang lama.
Perlu bersama seseorang yang kamu percayai saat pergi ke mana pun.
Menghindari jauh dari rumah.
Beberapa orang mampu memaksakan diri untuk menghadapi situasi yang tidak nyaman, tapi merasa sangat takut dan cemas saat melakukannya. "
Diagnosis Agoraphobia,"Diagnosis agoraphobia harus psikiater lakukan. Dokter akan bertanya seputar keluhan yang terjadi, seberapa sering keluhan tersebut terjadi, dan pada situasi apa.
Sering kali pengidap sulit untuk mengungkapkan perasaannya, sehingga biasanya perlu beberapa kali pertemuan untuk dapat menegakkan diagnosis agoraphobia. 
Diagnosis agoraphobia dilakukan berdasarkan kriteria diagnostik psikiatri DSM-5. Pada DSM-5, kriteria diagnostik untuk agoraphobia, yaitu ketakutan berlebih atau kecemasan yang dipicu oleh paparan yang pasti atau dapat diprediksi pada 2 atau lebih situasi berikut:
Menggunakan transportasi publik.
Berada di area terbuka.
Berada di area tertutup.
Berdiri dalam antrian atau keramaian.
Keluar sendirian dari rumah.
Pengidap menghindari situasi di atas karena yakin akan merasa terjebak atau tidak dapat meminta bantuan ketika dia mengalami serangan panik.
Situasi-situasi di atas selalu menyebabkan panik atau cemas.
Situasi-situasi di atas dihindari, membutuhkan pertolongan dari orang terdekat, ataupun akan mengidap ketakutan yang sangat kuat.
Memiliki ketakutan yang dialami lebih besar dari kemungkinan bahwa bahaya akan terjadi.
Ketakutan yang dialami atau upaya menghindari (avoidance) terjadi terus-menerus, berlangsung selama 6 bulan atau lebih. Selain itu, ketakutan yang dialami atau upaya menghindari (avoidance) menyebabkan penderitaan yang signifikan.
Jika ada kondisi medis lain terjadi (selain gangguan ini), maka ketakutan atau upaya menghindari (avoidance) akan semakin berlebih.
Ketakutan yang dialami atau upaya menghindari (avoidance) tidak dapat dijelaskan oleh gangguan medis lain."
Pengobatan Agoraphobia,"Pengobatan agoraphobia biasanya melibatkan kombinasi metode pengobatan:
1. Psikoterapi
Seorang terapis psikologi dapat membantu mengatasi ketakutan, dengan menggunakan terapi perilaku kognitif (CBT). Profesional kesehatan mental atau psikolog dapat membantu mengenali pikiran yang membuat kamu cemas. Kemudian, kamu akan belajar cara bereaksi secara lebih produktif.
Dengan menggunakan teknik relaksasi dan desensitisasi, psikolog mungkin membuat kamu membayangkan situasi yang menakutkan dan mengelola perasaannya.
Pada akhirnya, kamu akan dapat terlibat dalam aktivitas yang menimbulkan kecemasan, dan akan mengetahui cara mengelola emosi. Seiring waktu, terapi dapat melatih otak untuk berpikir dan merespons secara berbeda.
2. Obat-obatan
Dokter atau psikolog mungkin juga menyarankan penggunaan obat yang disebut inhibitor reuptake serotonin selektif (SSRI), atau inhibitor serotonin norepinefrin (SNRI). Obat-obatan tersebut dapat mengobati depresi dan gangguan kecemasan.
3. Perubahan gaya hidup
Perubahan gaya hidup berikut ini juga dapat membantumu mengatasi agoraphobia:
Menghindari penggunaan alkohol, kafein, dan zat lainnya.
Mengonsumsi makanan yang sehat dan seimbang.
Berolahraga secara teratur.
Melakukan latihan pernapasan."
Pencegahan Agoraphobia,"Hingga saat ini belum ada cara pasti untuk mencegah agoraphobia. Namun, kecemasan cenderung meningkat semakin kamu menghindari situasi yang ditakuti.
Jika kamu mulai memiliki sedikit ketakutan untuk pergi ke tempat yang aman, cobalah untuk berlatih pergi ke tempat tersebut berulang kali. Cara ini dapat membantumu merasa lebih nyaman di tempat-tempat tersebut.
Jika hal tersebut sulit untuk dilakukan, mintalah anggota keluarga atau teman untuk menemani, atau cari bantuan profesional. Sementara itu, jika kamu mengalami gangguan kecemasan atau mengalami serangan panik, dapatkan pengobatan sesegera mungkin untuk mencegah gejala menjadi lebih buruk."
Komplikasi Agoraphobia,"Agoraphobia dapat sangat membatasi aktivitas hidupmu. Jika kondisi agoraphobia yang kamu alami cukup parah, kamu mungkin tidak dapat meninggalkan rumah. Tanpa perawatan, beberapa orang tinggal di rumah selama bertahun-tahun.
Jika ini terjadi, kamu mungkin tidak dapat mengunjungi keluarga dan teman, pergi ke sekolah atau bekerja, mengerjakan tugas, atau berpartisipasi dalam aktivitas rutin harian lainnya. Lebih parahnya lagi, kamu mungkin jadi bergantung pada orang lain untuk mendapatkan bantuan.
Selain itu. agoraphobia juga dapat menyebabkan:
Depresi.
Penyalahgunaan alkohol atau narkoba.
Memiliki pikiran dan upaya bunuh diri."
Definisi Anoreksia Nervosa,"Anoreksia nervosa adalah penyakit kejiwaan yang membuat pengidapnya memiliki obsesi untuk memiliki tubuh kurus karena mereka sangat takut memiliki tubuh gemuk atau terlihat gemuk.
Meskipun sudah kurus, tetapi pengidapnya selalu menganggap tubuhnya masih kurang kurus atau gemuk. 
Selain dari anoreksia nervosa, ada juga gangguan makan lain yang cukup berbahaya, yaitu bulimia. Meski sama-sama termasuk dalam gangguan makan, kedua masalah kejiwaan ini memiliki perbedaan. 
Perbedaan antara anoreksia nervosa dan bulimia nervosa terlihat dari berat badan dan perilaku yang muncul. Gangguan kejiwaan bulimia umumnya memiliki berat badan normal karena pengidapnya memiliki obsesi makan berlebihan, lalu memuntahkan makanan tersebut. 
Sementara itu, pengidap anoreksia umumnya memiliki berat badan kurang dari normal dan memiliki obsesi untuk menjadi kurus. Anoreksia bisa sangat berbahaya karena menyebabkan malnutrisi pada tubuh pengidapnya. "
Penyebab Anoreksia Nervosa,"Sayangnya, ahli belum mengetahui apa yang menjadi penyebab anoreksia nervosa secara pasti.
Seperti banyak penyakit pada umumnya, mungkin ada kombinasi antara faktor biologis, psikologis, dan lingkungan.
1. Biologis
Meski belum jelas gen mana yang terlibat, mungkin ada perubahan genetik yang membuat beberapa orang berisiko lebih tinggi terkena anoreksia.
Selain itu, seseorang juga mungkin memiliki kecenderungan genetik terhadap perfeksionisme, kepekaan, ketekunan, dan semua ciri yang berkaitan dengan anoreksia.
2. Psikologis
Beberapa orang dengan anoreksia nervosa memiliki ciri kepribadian obsesif-kompulsif yang membuatnya lebih mudah untuk tetap berpegang pada diet ketat dan melupakan makanan meski sedang lapar. 
Mereka mungkin memiliki perfeksionisme ekstrem, yang menyebabkan munculnya pikiran bahwa mereka tidak pernah cukup kurus.
Selain itu, mereka juga memiliki tingkat kecemasan yang tinggi dan melakukan makan terbatas untuk menguranginya.
3. Lingkungan
Tidak sedikit budaya populer modern yang menekankan tubuh ideal adalah tubuh yang langsing. Sukses dan terkenal sering disamakan dengan tubuh ideal yang kurus.
Tekanan teman sebaya juga dapat membantu memicu keinginan untuk menjadi kurus, terutama antara gadis-gadis muda."
Faktor Risiko Anoreksia Nervosa,"Anoreksia lebih sering terjadi pada anak perempuan dan wanita Namun, kini anak laki-laki dan laki-laki dewasa juga mengembangkan gangguan makan, yang mungkin terkait dengan meningkatnya tekanan sosial. 
Anoreksia juga lebih sering terjadi pada kalangan remaja. Meski begitu, orang dari segala usia dapat mengembangkan kelainan makan ini.
Selain itu, gangguan ini jarang terjadi pada mereka yang berusia lebih dari 40 tahun. Remaja mungkin lebih berisiko karena semua perubahan yang terjadi pada tubuh mereka selama masa pubertas. 
Selain itu, remaja juga mungkin menghadapi tekanan dari teman dan lebih sensitif terhadap kritik atau bahkan komentar santai tentang berat badan maupun bentuk tubuh.
Sementara itu, ada beberapa faktor yang dapat meningkatkan risiko anoreksia, yaitu:
1. Genetika
Perubahan gen tertentu dapat membuat orang-orang tertentu berisiko lebih tinggi terkena anoreksia.
Mereka yang memiliki kerabat tingkat pertama, seperti orang tua, saudara kandung, atau anak yang memiliki gangguan tersebut memiliki risiko anoreksia yang jauh lebih tinggi. 
2. Pola makan buruk dan kelaparan
Diet merupakan faktor risiko paling utama untuk gangguan makan. Ada bukti kuat bahwa gejala anoreksia nervosa sebenarnya adalah gejala kelaparan.
Kondisi kelaparan memengaruhi otak dan perubahan suasana hati, kekakuan dalam berpikir, kecemasan, dan penurunan nafsu makan. 
Kelaparan dan penurunan berat badan dapat mengubah cara kerja otak pada individu yang berisiko. Kondisi ini selanjutnya dapat menormalkan terbentuknya perilaku makan yang terbatas dan menyulitkan mereka untuk kembali ke kebiasaan makan yang normal. 
3. Transisi
Baik itu sekolah baru, rumah atau pekerjaan, putus hubungan, maupun kematian atau penyakit yang terjadi pada orang tercinta, beberapa perubahan ini dapat membawa tekanan emosional dan meningkatkan risiko anoreksia."
Gejala Anoreksia Nervosa,"Tanda dan gejala anoreksia nervosa berhubungan dengan tanda kelaparan.
Anoreksia juga mencakup masalah emosional dan perilaku yang melibatkan persepsi berat badan yang tidak realistis dan ketakutan yang sangat kuat untuk menambah berat badan atau menjadi gemuk.
Tanda dan gejala mungkin sulit diketahui, karena apa yang dianggap sebagai berat badan rendah berbeda-beda untuk setiap orang. Selain itu, beberapa orang mungkin tidak tampak sangat kurus.
Pengidap anoreksia nervosa juga sering kali menyamarkan tubuh kurusnya, kebiasaan makan, atau masalah fisik mereka.
1. Gejala fisik
Tanda dan gejala fisik anoreksia mungkin termasuk:
Penurunan berat badan yang ekstrem atau tidak mengalami kenaikan berat badan sesuai perkembangan.
Penampilan kurus.
Jumlah elemen darah yang tidak normal.
Kelelahan.
Insomnia.
Pusing atau pingsan.
Perubahan warna kebiruan pada jari.
Rambut yang menipis, patah atau rontok.
Rambut halus berbulu halus menutupi tubuh.
Tidak mengalami menstruasi.
Sembelit dan sakit perut.
Kulit kering atau kekuningan.
Intoleransi dingin.
Irama jantung tidak teratur.
Tekanan darah rendah.
Dehidrasi.
Pembengkakan lengan atau tungkai.
Gigi terkikis dan kapalan di buku-buku jari karena muntah.
Jenis anoreksia binge and purge, mirip dengan bulimia. Namun, pengidap anoreksia umumnya berjuang dengan berat badan rendah yang tidak normal, sedangkan pengidap bulimia biasanya memiliki berat badan lebih dari normal.
2. Gejala emosi dan perilaku
Gejala perilaku anoreksia mungkin termasuk upaya menurunkan berat badan dengan:
Sangat membatasi asupan makanan melalui diet atau puasa.
Berolahraga secara berlebihan.
Makan berlebihan dan muntah yang disengaja untuk menyingkirkan makanan, mungkin termasuk penggunaan obat pencahar, enema, alat bantu diet, atau produk herbal.
Sementara itu, tanda dan gejala emosional dan perilaku dari pengidap anoreksia nervosa termasuk:
Keasyikan dengan makanan, yang terkadang termasuk memasak makanan yang rumit untuk orang lain tetapi dirinya sendiri tidak memakannya.
Sering melewatkan makan atau menolak makan.
Menyangkal lapar atau membuat alasan untuk tidak makan.
Hanya mengonsumsi beberapa makanan tertentu, biasanya yang rendah lemak dan kalori.
Tidak mau makan saat ada banyak orang.
Berbohong tentang berapa banyak makanan yang dikonsumsi.
Takut bertambah berat yang mungkin termasuk menimbang atau mengukur tubuh berulang kali.
Sering memeriksa cermin untuk mencari kekurangan.
Mengeluh tentang gemuk atau memiliki bagian tubuh yang gemuk.
Menutupi lapisan pakaian.
Suasana hari yang datar atau kurang emosi.
Penarikan sosial.
Sifat lekas marah.
Insomnia.
Kurang minat untuk melakukan hubungan intim."
"Diagnosis Anoreksia Nervosa","Dokter dapat melakukan diagnosis melalui wawancara, pemeriksaan fisik, dan berbagai pemeriksaan penunjang.
Dokter akan memberi diagnosis anoreksia apabila mendapati adanya karakteristik berikut: 
Pengidap membatasi asupan makanan untuk mempertahankan atau mendapat berat badan yang kurang dari normal tanpa memperhatikan kalori dan energi yang tubuh perlukan. 
Mempunyai ketakutan besar jika mengalami kenaikan berat badan atau gemuk. Rasa takut ini pada akhirnya akan membuat pengidap melakukan aktivitas yang dapat mengurangi berat badan yang sudah kurang dari normal.
Memiliki masalah dalam melihat diri sendiri, seperti terus melihat berat badan dan bentuk tubuh serta menyangkal kalau berat badannya sudah jauh di bawah normal. 
Kemudian, dokter akan melakukan beberapa pemeriksaan fisik berupa:
Mengukur berat dan tinggi badan.
Memeriksa kondisi kuku dan kulit.
Melakukan pemeriksaan pada lambung, jantung, dan paru-paru. 
Mengukur tanda vital, seperti suhu tubuh, detak jantung, dan tekanan darah. 
Supaya mendapatkan diagnosis yang lebih akurat, dokter mungkin merekomendasikan beberapa pemeriksaan penunjang.
Tujuannya untuk menghilangkan potensi masalah lain yang menyebabkan berat badan berkurang atau potensi adanya komplikasi. Tes tersebut termasuk:
Pemeriksaan laboratorium, termasuk tes hitung darah lengkap, tes urine, dan mengukur protein serta kadar elektrolit dalam darah. Pemeriksaan lainnya termasuk fungsi ginjal, kelenjar tiroid, dan organ hati. 
Melakukan evaluasi kondisi kejiwaan, berupa wawancara untuk mengetahui bagaimana perasaan, kebiasaan makan, dan pola pikir pengidap. 
Rontgen untuk mengetahui kesehatan dan kepadatan tulang, serta potensi adanya infeksi pada paru atau masalah pada organ jantung. "
Pengobatan Anoreksia Nervosa,"Berikut adalah beberapa langkah  pengobatan anoreksia nervosa:
1. Konsultasi dengan profesional medis dan psikologis
Langkah pertama yang penting adalah mencari bantuan dari tim medis dan psikologis yang berpengalaman dalam menangani gangguan makan.
Dokter, psikiater, atau psikolog dapat membantu mendiagnosis dan merencanakan perawatan yang tepat.
2. Nutrisi dan pemulihan berat badan
Dalam kasus anoreksia nervosa, pemulihan berat badan menjadi prioritas untuk mengembalikan fungsi tubuh yang sehat. Konsultasikan dengan ahli gizi untuk merencanakan diet yang seimbang.
3. Terapi perilaku kognitif (Cognitive Behavioral Therapy)
Cognitive behavioral therapy (CBT) adalah salah satu bentuk terapi yang efektif dalam mengatasi anoreksia nervosa.
Terapi ini membantu pengidapnya mengidentifikasi pola pikir dan perilaku negatif yang berkaitan dengan makan dan berat badan. Terapis juga akan membantu mereka untuk mengganti pola pikir tersebut dengan yang lebih sehat dan realistis.
4. Terapi keluarga
Jenis terapi ini umumnya diperuntukan untuk remaja yang mengidap anoreksia nervosa. 
Melibatkan keluarga dalam perawatan dapat membantu membangun dukungan dan memahami peran keluarga dalam pemulihan.
5. Dukungan kelompok
Bergabung dengan kelompok dukungan untuk gangguan makan dapat membantu individu merasa lebih diterima dan mendapatkan dukungan dari orang-orang yang mengalami hal serupa.
6. Mengatasi masalah emosional
Terapi juga membantu individu mengatasi masalah emosional yang memicu kondisi ini, seperti kecemasan, depresi, atau stres. Dokter biasanya meresepkan obat-obatan seperti antidepresan, antipsikotik, dan penstabil suasana hati.
7. Hindari membandingkan diri
Selain itu, jangan membandingkan diri dengan orang lain, terutama yang berkaitan dengan berat badan dan penampilan.
Fokus terhadap pemulihan untuk diri sendiri. Pengidap juga perlu terbuka. Jangan ragu untuk berbicara dengan orang-orang terdekat tentang perjuangan yang sudah dilalui. 
Jika sudah mencapai tahap yang gawat dan gejala malnutrisi sudah mengarah pada kematian, pengidap membutuhkan penanganan medis segera."
Efek Samping dari Anoreksia Nervosa,"Anoreksia dapat memiliki banyak komplikasi. Pada kondisi yang parah, komplikasinya bisa berujung pada kematian, bahkan ketika seseorang tidak terlalu kurus.
Kondisi ini bisa terjadi akibat irama jantung yang tidak normal (aritmia) atau ketidakseimbangan elektrolit maupun mineral seperti natrium, kalium, dan kalsium yang menjaga keseimbangan cairan dalam tubuh.
Komplikasi lain dari anoreksia meliputi:
Anemia.
Masalah jantung, seperti prolaps katup mitral, irama jantung yang tidak normal, atau gagal jantung. 
Keropos tulang (osteoporosis), meningkatkan risiko patah tulang. 
Kehilangan otot. 
Tidak mengalami menstruasi pada wanita. Sedangkan pada pria, penurunan kadar hormon testosteron.
Masalah pencernaan, seperti sembelit, kembung atau mual. 
Kelainan elektrolit, seperti kalium darah rendah, natrium dan klorida. 
Masalah ginjal. 
Jika pengidap anoreksia menjadi kekurangan gizi parah, setiap organ tubuh bisa rusak, termasuk otak, jantung, dan ginjal.
Kerusakan ini mungkin tidak sepenuhnya dapat pulih, bahkan ketika anoreksia sudah berhasil terkendali.
Selain sejumlah komplikasi fisik, pengidap anoreksia juga umumnya memiliki gangguan kesehatan mental lainnya. Ini termasuk:
Depresi, kecemasan, dan gangguan suasana hati lainnya. 
Gangguan kepribadian. 
Kelainan obsesif-kompulsif. 
Penyalahgunaan alkohol dan zat. 
Melukai diri sendiri, pikiran untuk bunuh diri, atau upaya bunuh diri. "
Pencegahan Anoreksia Nervosa,"Sayangnya, belum ada cara pasti untuk mencegah anoreksia nervosa. Meski begitu, ada beberapa hal yang bisa kamu coba untuk mengurangi risiko mengalami kondisi ini, antara lain: 
Tidak menuntut atau memberi tekanan pada keluarga yang berhubungan dengan penampilan maupun penampilan.
Membantu meningkatkan rasa percaya diri pada sesama anggota keluarga.
Berfokus pada hal lain yang tidak ada hubungannya dengan penampilan.
Berdiskusi dengan dokter apabila ingin menjalani diet maupun perubahan pada pola makan guna mengurangi berat badan."
Definisi BPD (Borderline Personality Disorder),"Borderline personality disorder (BPD) atau gangguan kepribadian ambang adalah masalah kesehatan mental yang memengaruhi cara berpikir seseorang mengenai  dirinya sendiri dan orang lain.
Akibatnya, pikiran tersebut dapat memengaruhi kehidupan sehari-hari pengidapnya. 
Selain itu, pengidap BPD juga menghadapi masalah citra diri, kesulitan mengelola emosi dan perilaku, dan pola hubungan yang tidak stabil.
Pikiran tersebut juga memicu perasaan takut penolakan, cemas, marah, tidak berarti, takut ditinggalkan, atau marah.  
Bahkan, mereka dengan kondisi ini juga memiliki kecenderungan menyakiti diri sendiri maupun orang lain.
Gangguan kepribadian ambang biasanya bermula pada awal masa dewasa dan umumnya membaik seiring bertambahnya usia."
Penyebab Borderline Personality Disorder,"Sampai saat ini, belum jelas dan pasti apa yang jadi penyebab borderline personality disorder (BPD).
Namun, para ahli menduga kondisi ini terjadi karena beberapa hal berikut:
1. Pelecehan dan trauma
Seseorang yang pernah mengalami pelecehan seksual, emosional atau fisik memiliki risiko BPD yang lebih tinggi.
Pengabaian, perlakuan yang salah atau perpisahan dari orang tua juga meningkatkan risiko gangguan kepribadian ambang.
2. Genetika
Gangguan kepribadian ambang diturunkan pada keluarga. Seseorang yang memiliki riwayat keluarga BPD, punya risiko mengembangkan kondisi tersebut.
3. Perubahan otak
Pada orang dengan BPD, bagian otak yang mengontrol emosi dan perilaku tidak tersinkronisasi dengan baik. Masalah ini memengaruhi cara kerja otak. 
Selain itu, penurunan fungsi dari zat kimia pada otak, seperti serotonin, juga memiliki kaitan dengan BPD."
Faktor Risiko,"Ada beberapa faktor yang dapat meningkatkan risiko borderline personality disorder. Faktor tersebut antara lain:
Pewarisan sifat. Seseorang mungkin lebih berisiko mengalami gangguan kepribadian ambang apabila memiliki ibu, ayah, saudara lelaki atau perempuan yang memiliki kelainan serupa.
Trauma masa kecil. Individu yang pernah mengalami pelecehan, kekerasan fisik atau trauma lainnya ketika kecil lebih berisiko mengalami BPD di kemudian hari."
Gejala Borderline Personality Disorder,"Biasanya, gejala borderline personality disorder (BPD) biasanya muncul pada akhir masa remaja atau awal masa dewasa. 
Peristiwa yang mengganggu atau pengalaman yang membuat stres dapat memicu gejala atau memperburuknya. 
Seiring waktu, gejala biasanya berkurang dan mungkin hilang sama sekali.
Beberapa orang mungkin hanya memiliki beberapa gejala, tapi lainnya bisa mengalami gejala yang lebih banyak.
Gejala pun kerap dianggap sebagai bipolar karena sangat mirip.
Berikut gejala yang mengindikasikan borderline personality disorder:
1. Perubahan suasana hati secara intens
Individu dengan BPD bisa mengalami perubahan suasana hati secara mendadak terhadap diri sendiri maupun orang lain.
Emosinya yang muncul bisa sangat irasional, seperti kemarahan, ketakutan, kecemasan, kebencian, dan kesedihan yang tidak terkendali.
Pengidapnya juga mungkin bisa marah atau menyerang orang lain dan cenderung kesulitan untuk menenangkan dirinya sendiri.
2. Takut ditinggalkan
Perasaan ini sangat umum terjadi pada pengidap BPD. Mereka tidak nyaman dengan kesendirian dan takut penolakan sampai ditinggalkan oleh orang lain.
Dalam kasus yang ekstrem, pengidap bisa nekat untuk melacak keberadaan orang yang mereka cintai atau mencegah orang tersebut pergi.
3. Sulit mempertahankan hubungan
Sebagian besar pengidap BPD kesulitan mempertahankan hubungan. Persahabatan, pernikahan, dan hubungan dengan anggota keluarga seringkali kacau dan tidak stabil.
4. Perilaku impulsif dan berbahaya
Pengidap BPD juga kerap impulsif dan melakukan perilaku yang berbahaya, seperti mengemudi sembrono, berkelahi, berjudi, penyalahgunaan zat, dan aktivitas seksual yang tidak aman. Perilaku ini bisa sulit atau tidak terkendali
5. Menyakiti diri sendiri
Seseorang dengan borderline personality disorder bisa memotong, membakar atau melukai diri sendiri sampai memiliki pikiran untuk bunuh diri. 
6. Depresi
Banyak orang dengan BPD sering merasa sedih, bosan, tidak terpenuhi atau “kosong.” Perasaan tidak berharga dan membenci diri sendiri juga umum terjadi.
7. Paranoia
Orang-orang yang mengidap BPD sering merasa khawatir terhadap pemikiran orang lain.
Mereka takut bahwa orang lain tidak menyukai dirinya atau tidak ingin menghabiskan waktu bersama."
Diagnosis Borderline Personality Disorder,"Guna mendapatkan diagnosis borderline personality disorder yang lebih akurat, dokter akan melakukan serangkaian pemeriksaan, antara lain: 
Wawancara mendetail.
Evaluasi psikologis, seperti mengisi kuesioner.
Riwayat medis dan pemeriksaan.
Mendiskusikan tanda dan gejala.
Namun, biasanya dokter hanya melakukan diagnosis borderline personality disorder pada orang dewasa, bukan pada anak-anak atau remaja.
Ini karena tanda dan gejala BPD dapat hilang seiring bertambahnya usia anak-anak dan menjadi lebih dewasa."
