Title,Description
Pengobatan Borderline Personality Disorder,"Pengobatan borderline personality disorder secara umum adalah psikoterapi, tetapi dokter sering menggabungkan dengan penanganan.
Selain itu, dokter juga dapat menyarankan rawat inap jika keselamatan pengidap BPD terancam, misalnya karena melakukan percobaan bunuh diri. 
Perawatan dapat membantu pengidap dalam mengelola dan mengatasi kendala yang sering mereka alami.
Beberapa jenis terapi ini, yaitu:
1. Dialectical Behavior Therapy (DBT)
Terapi ini menggunakan pendekatan berbasis kemampuan dalam mengajari pengidap BPD mengatur emosi, mentoleransi tekanan jiwa, dan memperbaiki hubungan sosial. 
Terapi DBT bisa pengidap lakukan secara sendiri atau bersama grup konsultasi dengan seorang terapis. 
2. Mentalization-Based Therapy (MBT)
Terapi satu ini menitikberatkan metode berpikir sebelum bereaksi.
MBT membantu pengidap mengenali perasaan dan pikirannya sendiri dengan menciptakan perspektif alternatif dari situasi yang tengah mereka alami.
3. Schema-Focused Therapy
Terapi ini membantu pengidap mengenali kebutuhan yang tidak terpenuhi pada periode awal hidup yang dapat memicu pola perilaku negatif.
Terapi akan berfokus pada usaha pemenuhan kebutuhan melalui cara yang lebih sehat agar terbangun pola perilaku yang positif. 
Tidak berbeda dengan DBT, terapi ini dapat berlangsung secara perorangan maupun dalam grup konsultasi.
4. Transference-Focused Psychotherapy (TFP) atau Terapi Psikodinamis
Terapi ini membantu pengidap memahami emosi dan kesulitan yang mereka alami dalam mengembangkan hubungan interpersonal.
TFP melihat hubungan yang terbangun antara pengidap dengan terapis dalam memahami masalah ini. 
Selanjutnya, pengidap akan menerapkan pengetahuan yang mereka dapatkan ke dalam situasi yang mereka alami pada saat ini.
5. General Psychiatric Management
Terapi ini menggunakan manajemen kasus dengan berfokus membuat peristiwa yang memicu tekanan emosional menjadi masuk akal.
Pendekatan berlangsung dengan menimbang perasaan sebagai konteks interpersonal dan dapat dokter gabungkan bersama pengobatan, terapi kelompok, penyuluhan pada keluarga, atau bahkan perorangan.
6. Systems Training for Emotional Predictability and Problem-Solving (STEPPS)
Terapi ini merupakan terapi kelompok bersama anggota keluarga, teman, pasangan, atau pengasuh sebagai bagian dari kelompok terapi yang berlangsung selama 20 minggu.
Terapi ini juga kerap menjadi terapi tambahan bersama psikoterapi lainnya."
Komplikasi Borderline Personality Disorder,"Borderline personality disorder dapat merusak kehidupan pengidapnya.
Kondisi ini juga bisa berdampak negatif pada hubungan, pekerjaan, sekolah, aktivitas sosial, dan citra diri.
Jika tak segera mendapat penanganan, BPD dapat memicu terjadinya beberapa kondisi berikut:
Konsumsi minuman beralkohol secara berlebihan atau penyalahgunaan obat-obatan. 
Gangguan kecemasan. 
Masalah pola makan. 
Gangguan bipolar. 
Kelainan stres pasca trauma (post-traumatic stress disorder/PTSD). 
Attention deficit/hyperactivity disorder (ADHD) atau penyakit hiperaktif. 
Gangguan kepribadian. 
Kehilangan hubungan yang baik dengan pasangan, teman sampai keluarga
Hilangnya pekerjaan atau sering berganti pekerjaan. 
Kehilangan kesempatan dalam menyelesaikan pendidikan. 
Terlibat dengan hukum, hingga masuk penjara. 
Mengalami cedera fisik akibat kecenderungan menyakiti diri sendiri. 
Hamil di luar rencana, memiliki penyakit menular seksual, atau kecelakaan akibat memiliki perilaku yang impulsif dan berisiko. 
Melakukan percobaan bunuh diri. "
Pencegahan Borderline Personality Disorder,"Sejauh ini, tidak ada cara pasti untuk mencegah borderline personality disorder. Pasalnya, masalah kesehatan mental ini sering menurun dalam keluarga. 
Namun, selalu optimis menjalani kehidupan dan tidak takut menghadapi kegagalan adalah cara agar tidak terjebak dalam masalah kepribadian.
Jika kamu sedang mengalami masalah, tidak ada salahnya untuk mengutarakan dengan keluarga maupun sahabat terdekat. 
Tidak memendam apa yang sedang kamu rasakan  bisa mengurangi perasaan stres dan tertekan.
Beberapa cara lain untuk mencegahnya, yaitu:
1. Pendidikan dan pemahaman
Dapatkan pemahaman tentang kondisi ini. Mengetahui tanda-tanda dan gejala BPD bisa menjadi langkah pertama dalam pencegahan. 
Edukasi tentang gangguan ini dapat membantu mengidentifikasi risiko atau gejala pada diri sendiri atau orang lain.
2. Konseling dini
Jika kamu merasa memiliki gejala yang berkaitan dengan BPD atau memiliki riwayat keluarga dengan gangguan ini, segera mencari konseling atau dukungan psikologis. 
Terapi dini dapat membantu mengatasi masalah emosional sebelum berkembang menjadi gangguan yang lebih serius.
3. Keterampilan pengelolaan emosi
Pelajari keterampilan pengelolaan emosi yang sehat, seperti regulasi emosi dan pemecahan masalah untuk mengurangi risiko BPD.
Terapi kognitif perilaku dan terapi dialektikal perilaku (DBT) adalah pendekatan sering digunakan dalam mengajarkan keterampilan ini.
4. Bentuk hubungan yang positif
Membangun dan memelihara hubungan yang sehat dengan teman, keluarga, dan pasangan dapat membantu mengurangi isolasi sosial dan meredakan stres yang dapat memicu gejala BPD.
5. Hindari penggunaan zat terlarang
Kamu wajib menghindari penyalahgunaan narkoba atau alkohol. Sebab, penggunaan zat-zat ini dapat memicu bahkan memperburuk gejala BPD yang sudah ada.
Pasalnya, zat tersebut bisa berdampak negatif pada kesehatan fisik maupun mental.
6. Perhatikan pola hubungan
Jika kamu memiliki kecenderungan untuk mengalami hubungan yang tidak stabil atau berkonflik, pertimbangkan untuk menjalani terapi pasangan atau keluarga.
Ini dapat membantu memahami dan memperbaiki pola interaksi yang tidak sehat.
7. Atasi trauma
Apabila kamu memiliki riwayat trauma atau pengalaman yang sulit, mencari dukungan untuk mengatasi trauma dapat membantu mengurangi risiko BPD.
Terapi trauma atau terapi EMDR adalah beberapa pendekatan yang dapat membantu.
8. Kelola stres
Belajar mengelola stres dengan cara seperti olahraga teratur, meditasi, yoga, dan aktivitas kreatif dapat membantu menjaga kesehatan mental.
Pasalnya, BPD juga bisa berawal dari stres yang tak teratasi."
Definisi Body Dysmorphic Disorder,"Gangguan dismorfik tubuh atau Body Dysmorphic Disorder (BDD) adalah gangguan kesehatan mental ketika seseorang tidak bisa berhenti memikirkan kekurangan yang dalam penampilannya. 
Padahal, kekurangan ini tampak kecil atau tidak terlihat, bahkan tidak menjadi perhatian besar bagi orang lain. Namun, pengidap akan merasa sangat malu, gelisah, dan cemas sehingga menghindari banyak situasi sosial.
Ketika memiliki gangguan ini, seseorang akan sangat fokus pada penampilan dan citra tubuh sendiri. Mereka akan berulang kali melihat bayangan pada cermin, berdandan atau mengoreksi sesuatu. Terkadang, hal ini dapat terjadi selama selama berjam-jam setiap hari. 
Kekurangan yang mereka rasakan dan perilaku berulang menyebabkan pengidap mengalami kesulitan yang signifikan. Tak jarang, hal ini akan memengaruhi aktivitas sehari-hari pengidap.
Selain itu, pengidap akan mencari berbagai prosedur kosmetik untuk mencoba “memperbaiki” kekurangan yang mereka rasakan. Setelah itu, mereka akan merasakan kepuasan sementara.
Sayangnya, kecemasan sering kali terjadi kembali dan pengidap dapat melanjutkan mencari cara lain untuk memperbaiki kekurangan yang terjadi."
Penyebab Body Dysmorphic Disorder,"Sayangnya, para ahli belum mengetahui dengan pasti apa yang menjadi penyebab body dysmorphic disorder.
Namun, para ahli menduga masalah mental ini terjadi karena gabungan dari banyak faktor berikut: 
Genetik. Studi menyebutkan, BDD lebih sering terjadi pada seseorang yang memiliki keluarga dengan riwayat kesehatan yang sama. Meski begitu, belum pasti apakah kelainan ini muncul karena kondisi genetik atau gabungan antara lingkungan serta pola asuh. 
Kelainan pada struktur otak. Kelainan yang terjadi pada struktur otak maupun senyawa yang terdapat pada bagian dalamnya juga dapat menjadi penyebab gangguan ini. 
Lingkungan. Penilaian yang tidak baik dari lingkungan terhadap citra diri pengidap, trauma masa lalu dan pengalaman buruk seperti menerima perlakukan body shaming, juga dapat memicu terjadinya body dysmorphic disorder."
Faktor Risiko Body Dysmorphic Disorder,"Body dysmorphic disorder biasanya terjadi pada awal masa remaja dan memengaruhi semua jenis kelamin.
Meski begitu, ada beberapa faktor tertentu yang dapat meningkatkan risiko mengembangkan kondisi kelainan mental ini, yaitu:
Memiliki keluarga dengan kelainan yang sama atau obsesif-kompulsif.
Pengalaman hidup yang negatif, seperti ejekan, penelantaran, atau pelecehan masa kanak-kanak.
Memiliki ciri kepribadian tertentu, seperti perfeksionisme.
Tekanan sosial atau ekspektasi kecantikan.
Memiliki kondisi kesehatan mental lain, seperti kecemasan, depresi atau anoreksia nervosa."
Gejala Body Dysmorphic Disorder,"Secara umum, tanda dan gejala body dysmorphic disorder, antara lain: 
Menjadi sangat sibuk dengan kekurangan yang muncul dalam penampilan yang bagi orang lain tidak terlihat atau tampak kecil.
Keyakinan yang kuat bahwa memiliki cacat penampilan yang membuat tubuh terasa jelek atau kurang.
Perasaan yakin bahwa orang lain memperhatikan penampilan diri mereka secara negatif atau mengejeknya.
Terlibat dalam perilaku yang bertujuan untuk memperbaiki atau menyembunyikan kekurangan yang muncul yang sulit dikendalikan, seperti sering bercermin.
Mencoba menyembunyikan kekurangan yang mereka rasakan dengan gaya, riasan, atau pakaian.
Terus-menerus membandingkan penampilan dirinya dengan orang lain.
Sering mencari kepastian tentang penampilan dirinya dari orang lain.
Memiliki kecenderungan perfeksionis.
Mencari prosedur kosmetik dengan sedikit kepuasan.
Menghindari situasi sosial.
Fokus dengan penampilan dan pikiran berlebihan serta perilaku berulang dapat menjadi hal yang tidak diinginkan, sulit dikendalikan, dan sangat memakan waktu sehingga dapat menyebabkan tekanan atau masalah besar dalam kehidupan sosial, pekerjaan, sekolah, atau fungsi lainnya.
Pengidap gangguan ini terlalu fokus pada satu atau lebih bagian tubuhnya. Bagian yang mereka fokuskan juga bisa berubah seiring waktu.
Namun, area paling umum yang cenderung membuat pengidapnya sering merasa kurang, antara lain:
Wajah, seperti hidung, kulit wajah, kerutan, jerawat dan noda lainnya.
Rambut, seperti penampilan, penipisan, dan kebotakan.
Penampilan kulit dan vena.
Ukuran payudara.
Ukuran dan massa otot.
Alat kelamin.
Suatu bentuk fokus membangun tubuh menjadi terlalu kecil atau tidak cukup berotot (dismorfia otot) terjadi hampir secara eksklusif pada laki-laki.
Namun, wawasan tentang gangguan mental ini dapat sangat bervariasi. 
Seseorang mungkin menyadari bahwa keyakinan tentang kekurangan yang mereka rasakan berlebihan atau tidak benar, berpikir bahwa itu benar, atau benar-benar yakin bahwa hal tersebut benar.
Semakin yakin seseorang akan keyakinan dirinya, semakin banyak kesusahan dan gangguan yang nantinya mereka alami dalam hidupnya.
"
Diagnosis Body Dysmorphic Disorder,"Proses diagnosis BDD melibatkan serangkaian evaluasi oleh psikolog maupun psikiater. Berikut langkah-langkahnya:
1. Wawancara Klinis
Pertama, dokter akan melakukan wawancara klinis dengan orang yang diduga mengidap BDD.
Selama proses ini, dokter akan meminta pasien untuk membicarakan perasaan, pikiran, dan perilakunya serta persepsi mereka tentang penampilan fisik.
2. Kriteria diagnostik
Selanjutnya, dokter akan mengacu pada Kriteria Diagnostik yang tercantum dalam Manual Diagnostik dan Statistik Gangguan Jiwa (DSM-5).
Apabila pasien memenuhi kriteria tersebut, maka ia ditetapkan mengalami BDD.
3. Memeriksa riwayat kesehatan
Dokter juga perlu mengumpulkan informasi tentang riwayat kesehatan mental dan medis pasien.
Mereka juga perlu mencari tahu apakah ada gangguan lain yang mungkin terkait atau berkontribusi pada gejala BDD.
4. Pemeriksaan fisik
Dokter juga bisa melakukan pemeriksaan fisik untuk mengesampikan kemungkinan penyakit lain yang gejalanya serupa dengan BDD.
5. Berkolaborasi dengan tim kesehatan lainnya
Diagnosis BDD sering melibatkan kerja sama antara profesional kesehatan mental, seperti dokter umum atau spesialis lain jika diperlukan.
Tujuannya untuk memastikan bahwa semua aspek kesehatan individu diperhitungkan secara matang."
Pengobatan Body Dysmorphic Disorder,"Adapun perawatan untuk gangguan kesehatan ini sering kali mencakup kombinasi terapi perilaku kognitif dan obat-obatan.
1. Terapi perilaku kognitif
Terapi perilaku kognitif berfokus pada:
Membantu pengidap mempelajari bagaimana pikiran negatif, reaksi emosional, dan perilaku mempertahankan masalah dari waktu ke waktu.
Menantang pikiran negatif otomatis tentang citra tubuh pasien dan mempelajari cara berpikir yang lebih fleksibel.
Mempelajari cara-cara alternatif untuk menangani dorongan atau ritual untuk membantu mengurangi pemeriksaan cermin atau pencarian kepastian.
Mengajari pengidap perilaku lain untuk meningkatkan kesehatan mental, seperti mengatasi penghindaran sosial.
Pengidap dan terapis dapat berbicara tentang tujuan terapi dan mengembangkan rencana perawatan untuk mempelajari dan memperkuat keterampilan mekanisme koping.
Ini melibatkan anggota keluarga dalam pengobatan sangat penting, terutama bagi remaja.
Baca artikel 5 Manfaat Terapi Kognitif bagi Pengidap Gangguan Kesehatan Mental untuk mengetahui apa saja manfaat melakukan terapi ini untuk menyembuhkan masalah kesehatan mental. 
2. Obat-Obatan
Meskipun tidak ada obat yang secara khusus mendapatkan persetujuan dari U.S. Food and Drug Administration (FDA) untuk mengobati masalah ini, pilihan obat untuk mengatasi kondisi kesehatan mental lain, seperti depresi dan gangguan obsesif-kompulsif mungkin cukup efektif.
Berikut beberapa jenis obatnya:
Inhibitor Reuptake Serotonin Selektif (SSRI). Masalah ini sebagian muncul karena masalah yang berkaitan dengan serotonin kimia otak, dokter mungkin akan meresepkan obat golongan SSRI. Obat golongan ini tampaknya lebih efektif untuk mengatasi kelainan tubuh tersebut daripada antidepresan lain serta dapat membantu mengendalikan pikiran negatif dan perilaku berulang.
Obat lain. Dalam beberapa kasus, pengidap mendapat manfaat dari minum obat lain selain SSRI, tergantung pada gejala yang terjadi.
3. Rawat Inap di Rumah Sakit
Dalam beberapa kasus, gejala Body Dysmorphic Disorder sangat parah sehingga pengidap memerlukan rawat inap psikiatri.
Dokter umumnya menyarankan hal ini jika pengidap tidak dapat memenuhi tanggung jawab sehari-hari atau berada dalam bahaya langsung untuk melukai diri sendiri.
4. Perubahan Gaya Hidup
Body Dysmorphic Disorder memerlukan perawatan dari profesional kesehatan mental. Namun, pengidap dapat melakukan beberapa hal untuk rencana perawatan, seperti:
Tetap ikuti rencana perawatan. Jangan melewatkan sesi terapi. Bahkan jika kamu sudah merasa sehat, teruslah minum obat. Jika berhenti, gejalanya bisa kembali.
Pelajari tentang gangguan yang muncul. Edukasi yang berhubungan dengan gangguan ini dapat memberdayakan dan memotivasi pengidap untuk tetap berpegang pada rencana perawatan.
Perhatikan tanda bahaya. Bekerjasamalah dengan dokter atau terapis untuk mempelajari apa yang memicu gejala. Buatlah rencana sehingga tahu apa yang harus kamu lakukan jika gejala kembali. Hubungi dokter atau terapis jika melihat adanya perubahan gejala atau perasaan.
Hindari narkoba dan alkohol. Sebab, alkohol dan obat-obatan rekreasional dapat memperburuk gejala atau berinteraksi dengan obat-obatan.
Tetap aktif. Aktivitas fisik dan olahraga dapat membantu mengelola banyak gejala, seperti depresi, stres, dan kecemasan. Misalnya, jalan kaki, jogging, berenang, berkebun, atau melakukan aktivitas fisik lain. Namun, hindari olahraga berlebihan sebagai cara untuk memperbaiki kekurangan yang muncul.
"
Definisi Gangguan Jiwa ,"Gangguan kesehatan jiwa adalah sindrom atau sekelompok gejala yang memengaruhi pikiran, perasaan, dan perilaku seseorang sehingga menyebabkan disfungsi dalam menjalankan aktivitas sehari-hari. Beberapa jenis gangguan jiwa termasuk depresi, gangguan kecemasan, skizofrenia, gangguan makan, dan perilaku adiktif.
Kondisi ini bisa membuat pengidapnya sengsara dan menimbulkan masalah dalam kehidupan sehari-hari, seperti di sekolah, tempat kerja, atau dalam hubungan. Namun, pada kebanyakan kasus, gabungan antara obat-obatan dan terapi bicara (psikoterapi) dapat membantu mengurangi tingkat keparahan gejala yang muncul."
Penyebab Gangguan Kesehatan Jiwa,"Gangguan kesehatan jiwa dapat terjadi karena banyak faktor, terutama faktor genetik dan lingkungan. Faktor-faktor tersebut termasuk:
Penurunan sifat. Gangguan jiwa lebih rentan terjadi pada individu dengan riwayat keluarga yang memiliki kondisi serupa. Melansir dari Mayo Clinic, gen tertentu nyatanya dapat meningkatkan risiko gangguan jiwa dan gejalanya bisa muncul dari situasi tertentu. 
Paparan lingkungan sebelum lahir. Paparan lingkungan, peradangan, racun, alkohol, atau obat-obatan saat berada dalam rahim juga memiliki kaitan dengan penyakit mental.
Kimia otak. Neurotransmitter adalah bahan kimia otak yang membawa sinyal ke bagian lain dari otak dan tubuh. Ketika jaringan saraf terganggu, fungsi reseptor saraf dan sistem saraf dapat berubah yang menyebabkan depresi maupun gangguan emosional lainnya."
Faktor Risiko Gangguan Jiwa,"Meski bisa terjadi pada siapa saja, ada beberapa faktor yang bisa meningkatkan risiko seseorang mengalami gangguan kesehatan jiwa, antara lain:
Adanya riwayat keluarga yang mengidap gangguan jiwa, seperti orang tua atau saudara kandung.
Situasi kehidupan yang penuh tekanan, seperti masalah keuangan, kematian orang tersayang, atau perceraian.
Kondisi medis (kronis) yang sedang berlangsung, seperti diabetes, kanker, penyakit autoimun, dan lain-lain.
Kerusakan otak akibat cedera serius (cedera otak traumatis), seperti pukulan keras pada kepala.
Pengalaman traumatis, seperti pertempuran militer, pelecehan seksual, atau penelantaran masa kecil.
Penggunaan alkohol atau obat-obatan.
Tidak memiliki teman atau hubungan yang sehat.
Pernah mengidap gangguan kesehatan jiwa sebelumnya.
Efek dari gangguan kesehatan mental bisa bersifat sementara atau justru bertahan lebih lama. Seseorang juga dapat memiliki lebih dari satu gangguan kesehatan jiwa pada waktu yang bersamaan. "
Jenis Gangguan Jiwa,"Masalah kesehatan jiwa menjadi salah satu gangguan kesehatan yang masih sering mendapat pandangan buruk dari banyak orang. Mereka beranggapan bahwa masalah ini hanya muncul karena seseorang mengalami halusinasi atau perilaku yang buruk.
Bahkan, tak sedikit pula orang yang mengira bahwa seseorang dengan kelainan jiwa harus dikucilkan. Padahal, masalah ini ada banyak jenis dan setiap jenisnya memiliki gejala yang tidak sama. Berikut beberapa jenis kelainan jiwa yang paling sering muncul:
1. Gangguan kepribadian
Seseorang yang mengidap gangguan kepribadian cenderung menunjukkan perasaan, pola pemikiran, dan tingkah laku yang berbeda dari orang lain pada umumnya. Masalah ini juga terbagi menjadi beberapa jenis, yaitu: 
Eksentrik, misalnya skizoid, gangguan paranoid, antisosial, dan skizotipal. 
Emosional atau dramatis, yaitu gangguan kepribadian histrionik, narsistik, dan ambang. 
Takut dan cemas, termasuk penghindaran atau avoidant, obsesif kompulsif, dan ketergantungan. 
2. Gangguan suasana hati
Perubahan suasana hati memang wajar terjadi, terutama jika ada hal yang menjadi pemicunya, seperti kelelahan, stres, atau mengalami tekanan batin. Meski begitu, orang yang mengalami kondisi ini sering menunjukkan perubahan suasana hati yang ekstrem dalam waktu yang terbilang singkat. 
Contohnya, suasana hati yang normal lalu menjadi sedih dalam waktu cepat, atau merasa bersemangat dan selanjutnya seperti merasa putus asa. Masalah gangguan kesehatan jiwa yang bisa membuat suasana hati berubah drastis termasuk depresi, gangguan siklotimik, dan gangguan bipolar. 
3. Gangguan psikotik
Masalah psikotik adalah kelainan jiwa yang parah yang membuat adanya pemikiran dan persepsi abnormal, contohnya penyakit skizofrenia. Seseorang dengan kondisi ini akan menunjukkan gejala halusinasi, percaya dengan berbagai hal yang sebenarnya tidak terjadi, bahkan melihat, merasa, dan mendengar semua hal yang tidak nyata. 
Menariknya, gangguan kesehatan mental ini juga terbagi menjadi beberapa jenis. Kamu bisa mendapat informasi lebih banyak lagi dari artikel Ini 9 Gangguan Psikotik yang Sering Didengar.
4. Gangguan kecemasan
Gangguan kecemasan bisa berupa gangguan kecemasan sosial, umum, gangguan panik, dan fobia. Masalah ini masuk dalam kelompok masalah kesehatan jiwa yang membuat pengidapnya merasa gelisah, cemas, dan kerap kesulitan untuk mengontrol perasaan itu. 
Saat mengalami masalah kecemasan, seseorang dapat menunjukkan gejala seperti sering berkeringat, dada berdebar, detak jantung lebih cepat, susah berkonsentrasi, sering pusing, mengalami insomnia, dan sering merasa khawatir serta cemas, sehingga kerap kesulitan beraktivitas. 
5. Gangguan stres pascatrauma (PTSD)
PTSD sering terjadi setelah seseorang mengalami peristiwa traumatis, misalnya pelecehan seksual, bencana alam, atau kematian orang terdekat. Seseorang dengan kondisi ini sering kali kesulitan melupakan peristiwa yang tidak menyenangkan itu. 
6. Gangguan obsesif kompulsif (OCD)
Masalah kesehatan jiwa yang satu ini muncul dengan obsesi maupun pikiran yang tidak bisa terkendali akan suatu hal, sehingga membuat pengidapnya melakukan kegiatan berulang kali. 
Pengidap masalah mental ini biasanya terobsesi dengan angka khusus, contohnya angka 3. Kondisi ini akan membuat mereka merasa harus melakukan kegiatan tertentu, misalnya mencuci tangan sampai 3 kali, atau bercermin sebanyak 3 kali. Apabila hal itu tidak mereka lakukan, maka pengidap akan merasa khawatir berlebihan. 
7. Gangguan pengendalian impuls dan kecanduan
Selanjutnya, masalah pengendalian impuls dan kecanduan, yang membuat seseorang tidak bisa menahan keinginan untuk melakukan berbagai tindakan yang bisa berbahaya untuk diri sendiri dan orang lain. Contohnya mencuri atau kleptomania, berjudi, dan piromania atau menyulut api. 
Sementara itu, masalah adiksi atau kecanduan sering kali terjadi karena seseorang yang menyalahgunakan alkohol atau obat terlarang, dalam hal ini narkoba. Selain itu, seseorang juga bisa mengalami kecanduan terhadap aktivitas tertentu, misalnya belanja atau berhubungan seksual. 
8. Gangguan makan
Terakhir adalah gangguan makan, masalah mental serius yang membuat seseorang mengalami masalah pada pola makan dan asupan makanan. Kondisi ini kerap membuat pengidapnya mengalami permasalahan pada gizi, bisa jadi obesitas atau malnutrisi. Contohnya seperti bulimia, anoreksia nervosa, dan makan berlebihan. "
Gejala Gangguan Jiwa,"Tanda dan gejala gangguan kesehatan jiwa dapat bervariasi bergantung pada jenisnya, kondisi, dan faktor lainnya. Gejala biasanya memengaruhi emosi, pikiran, dan perilaku. Namun, umumnya masalah kesehatan mental ini dapat menyebabkan gejala berikut ini:
Merasa sedih sepanjang waktu.
Bingung atau tidak mampu berkonsentrasi.
Ketakutan, kekhawatiran yang berlebihan, atau perasaan bersalah yang ekstrem.
Perubahan suasana hati yang ekstrem.
Menarik diri untuk berhubungan dengan teman atau melakukan aktivitas.
Kelelahan yang signifikan, seperti kekurangan energi atau masalah tidur. Kamu bisa membaca artikel Benarkah Gangguan Tidur adalah Gejala Gangguan Jiwa? untuk mengetahui kaitan antara masalah tidur dan kondisi psikologis.
Mengalami delusi, paranoia atau halusinasi.
Tidak mampu mengatasi masalah sehari-hari atau stres. 
Kesulitan memahami situasi dan berhubungan dengan orang-orang.
Masalah dengan alkohol atau penggunaan narkoba.
Perubahan besar dalam kebiasaan makan.
Perubahan gairah seks.
Kemarahan, permusuhan, atau kekerasan yang berlebihan.
Punya pikiran bunuh diri."
