Title,Description
Diagnosis Gangguan Kesehatan Jiwa,"Untuk mendiagnosis gangguan jiwa, dokter perlu melakukan serangkaian tes berikut ini:
Pemeriksaan fisik. Melalui pemeriksaan fisik, dokter dapat mengesampingkan masalah fisik yang dapat menyebabkan gejala.
Tes laboratorium. Pemeriksaan ini bertujuan untuk mengidentifikasi fungsi tiroid atau skrining penggunaan alkohol dan obat-obatan.
Evaluasi psikologis. Dokter juga perlu berbicara kepada pengidap tentang gejala, pikiran, perasaan, dan pola perilaku yang muncul.  Salah satu tes yang resmi dan dapat digunakan untuk mendiagnosis gangguan jiwa adalah dengan MMPI-2 (Minnesota Multiphasic Personality Inventory). Tes MMPI-2 adalah sebuah alat tes inventori yang berisi banyak pertanyaan dengan option ya dan tidak, tujuannya adalah untuk mengetahui kepribadian seseorang, terutama gangguan psikologis yang ada dalam diri, seperti gangguan antisosial, gangguan seksual, gangguan depresi, kebohongan, dan sebagainya.
Pengobatan Gangguan Jiwa
Perawatan gangguan kesehatan jiwa tergantung pada jenisnya, tingkat keparahan, dan perawatan yang paling tepat. Dalam banyak kasus, dokter biasanya akan memberikan kombinasi perawatan. Berikut opsi perawatan yang bisa menjadi pertimbangan:
1. Obat
Meski tidak menyembuhkan penyakit mental, obat-obatan psikiatri tetap penting untuk mengurangi gejala yang signifikan. Obat ini juga dapat membantu perawatan lain lebih efektif. Jenis obat yang dokter berikan juga tergantung pada situasi dan bagaimana respons tubuh. Beberapa obat psikiatri yang paling sering dokter resepkan adalah:
Antidepresan. Obat ini bertujuan untuk mengobati depresi, kecemasan, dan beberapa kondisi lainnya. Antidepresan dapat membantu memperbaiki gejala, seperti kesedihan, keputusasaan, kekurangan energi, kesulitan berkonsentrasi, dan kurangnya minat dalam aktivitas. 
Antikecemasan. Obat ini bertujuan untuk mengobati gangguan kecemasan, seperti gangguan kecemasan umum atau gangguan panik. Antikecemasan juga sering dokter resepkan untuk mengurangi agitasi dan insomnia. 
Penstabil suasana hati. Jenis obat yang satu ini sering bertujuan untuk mengobati gangguan bipolar yang melibatkan episode mania dan depresi secara bergantian. Terkadang, dokter menggunakan obat ini bersamaan dengan antidepresan untuk mengobati depresi.
Antipsikotik. Obat antipsikotik biasanya untuk mengobati gangguan psikotik, seperti skizofrenia. Antipsikotik juga bertujuan untuk mengobati gangguan bipolar atau pemakaian bersama antidepresan untuk mengobati depresi.
2. Psikoterapi
Selama sesi terapi bicara atau psikoterapi, pengidap gangguan kesehatan jiwa akan belajar tentang kondisi dan suasana hati, perasaan, pikiran, serta perilakunya. Dengan wawasan dan pengetahuan yang didapatkan dari psikiater, pengidap selanjutnya dapat mempelajari keterampilan untuk mengatasi gejala dan mengelola stres.
3. Perawatan stimulasi otak
Dokter terkadang menggunakan stimulasi otak untuk mengatasi depresi dan gangguan kesehatan mental lainnya. Namun, stimulasi otak akan menjadi opsi penanganan apabila obat dan psikoterapi tidak memberikan hasil yang efektif. 
Contoh perawatan stimulasi otak termasuk terapi electroconvulsive, stimulasi magnetik transkranial, stimulasi otak dalam, dan stimulasi saraf vagus.
4. Program perawatan rumah sakit dan residensial
Program perawatan ini umumnya menjadi pilihan untuk gangguan kesehatan jiwa yang parah. Dokter biasanya menyarankan opsi ini ketika pengidap sudah tidak mampu merawat diri sendiri dengan benar, atau membahayakan dirinya sendiri maupun orang lain. 
Pilihannya mencakup perawatan rawat inap 24 jam, rawat inap sebagian atau sehari, atau perawatan residensial, yang menawarkan tempat tinggal sementara. Pilihan lainnya mungkin perawatan rawat jalan intensif.
5. Perawatan penyalahgunaan zat
Masalah penggunaan zat biasanya terjadi bersamaan dengan gangguan jiwa. Jika tidak segera mendapatkan penanganan, penyalahgunaan zat bisa mengganggu pengobatan dan memperburuk gangguan jiwa."
Komplikasi Gangguan Jiwa,"Gangguan jiwa yang tidak segera mendapatkan penanganan dapat menyebabkan masalah kesehatan emosional, perilaku, dan fisik yang parah. Beberapa komplikasi dari gangguan kesehatan jiwa yang kerap terjadi, antara lain:
Penurunan kualitas hidup.
Konflik keluarga.
Sulit memiliki hubungan dengan orang lain.
Mengisolasi diri. 
Penyalahgunaan tembakau, alkohol, dan obat-obatan lainnya.
Tidak mampu bekerja atau bersekolah.
Pelanggaran hukum.
Masalah keuangan.
Kemiskinan dan tunawisma.
Menyakiti diri sendiri dan menyakiti orang lain, termasuk bunuh diri atau pembunuhan.
Sistem kekebalan tubuh melemah, sehingga tubuh sulit melawan infeksi.
Penyakit jantung dan kondisi medis lainnya."
Pencegahan Gangguan Jiwa,"Tidak ada cara pasti untuk mencegah gangguan jiwa. Bagi seseorang yang berisiko mengalami kondisi ini, penting bagi mereka untuk mampu mengelola sekaligus mengendalikan stres. Adapun sejumlah tips yang bisa kamu coba, yaitu:
Perhatikan tanda-tanda peringatan. Tanyakan dengan dokter atau terapis terkait hal apa saja yang bisa memicu timbulnya gejala. Buat rencana sehingga kamu mengetahui tindakan antisipasi jika gejala kembali. Hubungi dokter atau terapis apabila kamu merasa adanya perubahan gejala atau perasaan. Pertimbangkan untuk melibatkan anggota keluarga atau teman untuk melihat tanda-tanda peringatan.
Dapatkan perawatan medis rutin. Jangan mengabaikan pemeriksaan atau melewatkan kunjungan ke dokter atau terapis, terutama saat kamu merasa gejala semakin memburuk. Kamu mungkin memiliki masalah kesehatan baru yang perlu segera mendapat perawatan, atau mungkin mengalami efek samping obat.
Dapatkan bantuan saat membutuhkannya. Kondisi gangguan jiwa bisa lebih sulit diobati jika kamu menunggu sampai gejalanya memburuk. Perawatan lebih lanjut dalam jangka panjang dapat membantu mencegah kekambuhan gejala.
Terapkan gaya hidup sehat. Tidur yang cukup, makan sehat dan aktivitas fisik yang teratur amat penting. Cobalah untuk mempertahankan jadwal yang teratur. Segera hubungi dokter jika mengalami kesulitan tidur atau memiliki pertanyaan tentang diet dan aktivitas fisik."
Definisi Kepribadian Ganda,"Kepribadian ganda atau gangguan identitas disosiatif adalah suatu kondisi kesehatan mental,  ketika seseorang memiliki dua atau lebih kepribadian yang berbeda antara satu dengan lainnya.
Pengidap gangguan ini mengalami kepribadian yang berubah-ubah tanpa ia sadari. 
Ciri gangguan ini berupa masalah memori, kesadaran, atau kepribadian. Semua kondisi tersebut muncul akibat stres atau kejadian traumatis yang pengidapnya alami pada masa kecilnya.
Bentuk trauma ini dapat berupa kekerasan fisik atau emosional yang terjadi secara berulang-ulang."
Penyebab Kepribadian Ganda,"Hingga saat ini penyebab pasti dari kepribadian ganda belum jelas. 
Namun, ada beberapa kondisi yang diduga menjadi penyebabnya, yaitu:
1. Trauma berat
Pernah mengalami trauma fisik, seksual, atau emosional yang parah pada masa kanak-kanak atau masa remaja bisa memicu kondisi ini. 
Mereka yang mengalami peristiwa traumatis mungkin mengembangkan identitas yang berbeda sebagai mekanisme koping untuk melindungi diri dari ingatan dan rasa sakit tersebut. 
Gejala traumatis ini tak sedikit yang menyepelekannya. Oleh karena itu, kenali Mitos dan Fakta Kepribadian Ganda supaya bisa lebih memahami kondisi ini. 
2. Ketidakstabilan lingkungan
Lingkungan yang tidak stabil, disfungsional, atau berbahaya juga dapat berperan dalam perkembangan kondisi ini.
Contohnya, seperti berada dalam keluarga yang terlibat dalam pelecehan, kekerasan, atau konflik kronis.
3. Genetik
Beberapa penelitian menunjukkan bahwa faktor genetik mungkin memainkan peran dalam kerentanan seseorang terhadap gangguan kepribadian ini.
Namun, genetika bukan sebagai penyebab utama tetapi lebih sebagai faktor yang berkontribusi.
4. Tidak mampu menangani stres
Mereka yang tidak memiliki keterampilan atau dukungan yang cukup untuk mengatasi stres atau trauma mungkin lebih rentan terhadap perkembangan kepribadian ganda.
Faktor Risiko Kepribadian Ganda
Terdapat beberapa pengalaman traumatis yang bisa memicu kepribadian ganda, antara lain:
Kecelakaan.
Bencana alam.
Pelecehan seksual.
Tindak kekerasan.
Sebagai upaya untuk mengatasi peristiwa traumatis, secara tidak sadar, otak pengidap kepribadian ganda berusaha untuk memisahkan memori buruk tersebut dengan kehidupan normal sehari-hari. Dalam istilah medis kondisi tersebut disebut dengan disosiasi. 
Mekanisme disosiasi ini yang menimbulkan gejala kepribadian ganda.
Kondisi ini juga bisa terjadi ketika ada pengabaian atau pelecehan emosional yang terus menerus, bahkan meskipun tidak ada pelecehan fisik atau seksual. "
Gejala Kepribadian Ganda,"Pengidap kepribadian ganda setidaknya memiliki dua macam kepribadian. Saat kepribadian yang satu sedang terjadi, pengidap tidak ingat bahwa ia memiliki kepribadian yang lain, begitu pula sebaliknya. 
Kepribadian yang berbeda tersebut dapat disertai dengan identitas yang berbeda pula. Misalnya, jenis kelamin yang berbeda atau nama yang berbeda. 
Perubahan kepribadian ini umumnya akibat kejadian yang mengingatkan pengidapnya pada peristiwa traumatis yang pernah ia alami.
Berikut beberapa gejala utama kepribadian ganda:
Depersonalisasi, ini adalah perasaan terlepas dari tubuh dan pikirannya sendiri atau yang sering disebut sebagai pengalaman ‘keluar tubuh’.
Derealisasi, perasaan bahwa dunia ini tidak nyata atau lingkungan sekitar tampak berkabut.
Amnesia, kegagalan untuk mengingat informasi pribadi yang signifikan. Ada juga mikro-amnesia, yaitu ketika pengidap tidak mengingat percakapan yang pernah terjadi.
Kebingungan identitas atau perubahan identitas. Pengidap merasa bingung tentang siapa dirinya seperti apa hobinya, cita-cita, agamanya, dan lain-lain. Selain itu, pengidap juga bisa mengalami distorsi dalam waktu, tempat, dan situasi.
Akibat gangguan kepribadian dan gangguan ingatan ini, pengidap kepribadian ganda sering kali mengalami gangguan relasi dengan orang di sekitarnya.
Selain itu, pengidap juga dapat mengalami beberapa gejala lainnya, seperti:
Kecemasan, serangan panik, atau fobia.
Depresi.
Suasana hati yang berubah-ubah (misalnya saat ini sedang sangat senang, tetapi dalam 30 menit kemudian dapat meledak marah karena hal sepele).
Gangguan tidur.
Memiliki keinginan bunuh diri.
Halusinasi (misalnya mendengar suara tertentu padahal tidak ada suara apapun).
Penyalahgunaan alkohol dan narkoba."
Diagnosis Kepribadian Ganda,"Dokter spesialis kesehatan jiwa atau psikiater akan mendiagnosis kepribadian ganda dengan melakukan wawancara medis lengkap, dan pemeriksaan fisik menyeluruh terlebih dahulu. 
Selanjutnya, psikiater akan memastikan apakah gejala yang muncul akibat penyakit otak atau efek samping dari obat-obatan tertentu. 
Untuk mengetahui hal ini, dokter perlu melakukan pemeriksaan CT scan atau MRI, serta pemeriksaan darah. 
Jika hasilnya tidak menunjukan penyakit apa pun, seorang psikiater akan melakukan wawancara dan melakukan observasi untuk memastikan adanya kondisi ini.
Menurut Diagnostic and Statistical Manual of Mental Disorders, edisi kelima (DSM-5), berikut kriteria seseorang bisa didiagnosis mengalami gangguan kepribadian ganda:
Terdapat dua atau lebih identitas atau kepribadian yang berbeda-beda.
Gejala amnesia harus ada, yaitu kesenjangan dalam mengingat peristiwa sehari-hari, informasi pribadi yang penting, dan atau peristiwa traumatis.
Gejala-gejala tersebut menyebabkan penderitaan yang signifikan pada pengidap, yang menyebabkan pengidap mengalami kesulitan berfungsi dalam satu atau lebih bidang utama kehidupan karena gangguan tersebut.
Gangguan tersebut bukan termasuk dalam praktik budaya atau agama yang normal.
Gangguan bukan karena efek fisiologis langsung dari suatu zat (misalnya perilaku kacau karena alkohol) atau kondisi umum (seperti kejang parsial kompleks)."
Pengobatan Kepribadian Ganda,"Tujuan pengobatan kondisi ini adalah untuk menghubungkan kepribadian yang berbeda-beda menjadi satu jenis kepribadian saja.
Maka dari, pengidap bisa kembali menjalankan fungsinya dalam kehidupan sehari-hari dengan baik. 
Untuk mencapai tujuan tersebut, pengobatan berfokus untuk menolong pengidap kepribadian ganda untuk menyadari stres psikis. 
Selanjutnya, berlatih menerima dan kemudian berupaya mengatasinya dengan bantuan psikiater.
Beberapa metode pengobatan yang bisa dokter lakukan, antara lain:
1. Terapi kognitif perilaku (cognitive behavior therapy)
Perawatan ini dengan cara diskusi antara psikiater dan pengidap kepribadian ganda, yang bertujuan untuk mengubah pola pikir dan perilaku.
2. Terapi keluarga (family therapy)
Dalam terapi ini, keluarga dilibatkan untuk memahami tanda-tanda pengidap akan berubah kepribadian, untuk membantu mengontrol dan menenangkan pengidap.
3. Hipnoterapi
Biasanya hipnoterapi dokter kombinasikan dengan psikoterapi. Hipnosis klinis bisa membantu pengidap mengakses ingatan yang ditekan, mengontrol perilaku bermasalah yang menyertai gangguan kepribadian, serta membantu mengintegrasikan kepribadian menjadi satu.
4. Terapi seni
Jenis perawatan ini dapat berupa melukis, menyanyi, bermusik, dan sebagainya, yang bertujuan untuk membantu pengidap dalam mengeksplorasi pikiran dan perasaannya.
5. Obat-obatan antidepresan
Konsumsi obat-obatan bisa membantu meringankan gejala yang pengidapnya alami, tetapi bukan sebagai terapi utama untuk mengatasi kepribadian ganda."
Komplikasi Gangguan Kepribadian Ganda,"Orang dengan gangguan ini berisiko tinggi mengalami komplikasi dan gangguan terkait berikut:
Menyakiti diri sendiri.
Berpikir dan mencoba bunuh diri.
Disfungsi seksual.
Mengalami gangguan depresi dan kecemasan.
Mengalami gangguan tidur, termasuk mimpi buruk, insomnia dan berjalan dalam tidur.
Gangguan makan.
Kesulitan besar dalam hubungan pribadi dan di tempat kerja."
Pencegahan Kepribadian Ganda,"Pencegahan kepribadian ganda yang paling utama yakni dengan menghindari faktor pencetusnya.
Upaya lain yang bisa kamu lakukan, yaitu:
Mendapatkan edukasi kesehatan mental agar bisa memahami gejala-gejala gangguan mental.
 Mengatasi trauma sejak dini dengan meminta dukungan dan menjalani terapi atau konseling.
Menciptakan lingkungan yang aman, mendukung, dan stabil dalam keluarga.
Melatih keterampilan pengelolaan stres. Caranya bisa dengan berlatih meditasi, yoga dan olahraga
Menambah jaringan dukungan sosial yang kuat agar bisa menghadapi stres dan trauma dengan lebih baik. Keluarga, teman, atau kelompok dukungan bisa menjadi sumber dukungan yang penting.
Hindari penyalahgunaan alkohol atau obat-obatan terlarang, karena penyalahgunaan zat dapat memperburuk gangguan kepribadian. "
Definisi Psikosis,"Psikosis adalah penyakit mental yang menyebabkan pengidapnya mengalami gangguan dalam membedakan antara imajinasi dengan realita. Gangguan psikosis ditandai dengan munculnya gejala halusinasi dan waham (delusi). Jika tidak ditangani dengan tepat, kondisi ini bisa semakin parah dan mebuat pengidapnya semakin bermasalah dengan kondisi mentalnya. 
Penyakit ini terjadi karena ada gangguan pada otak. Gangguan yang terjadi memengaruhi cara kerja organ ini dalam memproses informasi. Alhasil, pengidapnya mengalami perubahan dalam cara berpikir dan berprilaku. Gangguan mental bisa mengganggu kehidupan dna menurunkan kualitas hidup pengidapnya, sehingga harus segera mendapatkan penanganan yang tepat. "
Penyebab Psikosis,"Penyebab dari psikosis berbeda-beda dan penyebab pastinya sering kali tidak jelas. Namun, secara umum masih belum diketahui pasti apa yang menjadi penyebab penyakit ini. 
Psikosis rentan muncul sebagai manifestasi gejala dari penyakit, tetapi dapat juga dipicu melalui konsumsi obat-obatan, terutama obat-obatan terlarang, kekurangan tidur, dan faktor lingkungan.
Beberapa kondisi pada tubuh yang dapat menyebabkan psikosis antara lain adalah:
Penyakit Parkinson
Penyakit Huntington.
Tumor atau kista di otak.
Penyakit Alzheimer.
Stroke.
Epilepsi.
HIV, Sifilisis, dan infeksi pada otak lainnya.
Trauma kepala.
Overdosis alkohol dan NAPZA.
Psikosis juga dapat muncul sebagai suatu manifestasi dari adanya gangguan pada jiwa maupun kepribadian seseorang, antara lain:
Kelainan bipolar.
Depresi.
Skizofrenia.
Gangguan delusi.
Gangguan psikotik menyeluruh."
Faktor Risiko Psikosis,"Terdapat beberapa faktor risiko yang dapat menungkatkan risiko seseorang mengalami psikosis, antara lain: 
Memiliki pola tidur yang buruk.
Gemar mengonsumsi alkohol atau menggunakan ganja.
Mengalami trauma akibat kehilangan seseorang yang dicintai, seperti orangtua atau pasangan. 
Risiko penyakit mental ini juga disebut meningkat pada orang yang memiliki orang tua dengan riwayat penyakit sama. Pengidap gangguan mental yang harus menjalani pengobatan jangka panjang juga rentan mengalami psikosis. "
Gejala Psikosis,"Seseorang dengan psikosis biasanya akan memiliki gejala yang meliputi:
Halusinasi, yaitu sebuah kondisi yang ditandai dengan adanya sebuah persepsi yang dirasakan tanpa adanya rangsangan nyata terhadap panca indra. Hal ini meliputi penglihatan, pendengaran, penciuman, dan sentuhan. Sebagai contoh, pengidap merasa melihat suatu sosok atau mendengar suara yang tidak nyata.
Delusi atau waham adalah sebuah keyakinan yang dipegang oleh pengidap, tetapi keyakinan tersebut adalah salah. Misalnya, seseorang merasa dirinya adalah seorang manusia super yang bisa terbang.
Rasa cemas yang berlebihan.
Penuh dengan rasa curiga.
Sulit berkonsentrasi.
Mengalami gangguan mood.
Cenderung menjadi murung, menarik diri dari lingkungan keluarga atau teman.
Tidur terus-menerus.
Depresi.
Gangguan dalam berbicara, seperti tidak fokus, berpindah dari topik satu ke topik lain, dan sering kali tidak nyambung.
Memiliki pikiran-pikiran untuk bunuh diri dan melakukan percobaan bunuh diri."
Diagnosis Psikosis,"Diagnosis dari psikosis ditegakkan melalui pemeriksaan status mental. Kemudian dokter akan melakukan beberapa pemeriksaan penunjang jika dicurigai gejala psikosis yang muncul diakibatkan suatu kelainan organik yang diidap oleh pengidap. Misalnya dengan pemeriksaan CT scan atau MRI."
Pengobatan Psikosis,"Gejala psikosis dapat ditangani dengan pemberian obat-obatan dan terapi kognitif. Ketika pengidap mengalami serangan psikosis seperti sedang mengamuk, biasanya dokter memberikan penanganan utama dengan menginjeksikan obat penenang.
Obat anti psikosis diberikan kepada untuk dikonsumsi dengan tujuan mengontrol kondisi pengidap dan mencegah terjadinya serangan selanjutnya. Sementara itu, terapi kognitif ditujukan untuk melatih pola dan cara berpikir pengidap, cara ini dipercaya lebih efektif dibandingkan konsumsi obat semata."
Pencegahan Psikosis,"Sampai saat ini belum ada pencegahan pasti yang dapat dilakukan untuk mencegah terjadinya psikosis secara umum. Namun, beberapa cara yang dapat dilakukan sebagai upaya menghindari kondisi ini adalah dengan:
Mengobati kondisi yang bisa memicu psikosis
Menerapkan gaya hidup sehat dan berolahraga 
Cukup tidur
Menghindari alkohol dan NAPZA
Menghindari depresi. Salah satu cara yang dapat dilakukan adalah dengan pergi berlibur, berbicara dengan konselor jika menghadapi kesulitan dalam menyelesaikan suatu masalah."
Definisi PTSD,"PTSD (Post-Traumatic Stress Disorder) atau gangguan stres pascatrauma adalah kondisi kesehatan jiwa yang dipicu oleh peristiwa traumatis. Misalnya, pelecehan seksual, bencana alam, peperangan, atau kecelakaan. 
Akan tetapi, tidak semua orang yang mengingat atau pernah mengalami kejadian yang traumatis akan mengidap PTSD. Sebab, ada beberapa ciri khas yang menjadi acuan dokter untuk mendiagnosis apakah seseorang mengalami kelainan ini atau tidak. "
Penyebab PTSD,"PTSD bisa terjadi setelah seseorang melihat atau mengalami kejadian yang mengancam atau membahayakan nyawa. Namun, ahli belum mengetahui alasan mengapa kondisi tersebut bisa memicu munculnya masalah kesehatan mental ini pada sebagian orang. 
Hanya, muncul dugaan bahwa kelainan tersebut terjadi karena gabungan dari beberapa kondisi berikut:
Memiliki pengalaman yang tidak menyenangkan.
Adanya riwayat kelainan kesehatan psikologis pada keluarga. 
Mempunyai kepribadian temperamental.
Sementara itu, beberapa kejadian yang paling sering menjadi penyebab PTSD, antara lain:
Kecelakaan.
Peperangan.
Bencana alam.
Mengalami kekerasan fisik.
Mendapatkan perundungan.
Mengalami pelecehan seksual.
Menjalani tindakan medis seperti operasi.
Memiliki kondisi medis yang mengancam nyawa."
Faktor Risiko PTSD,"Beberapa faktor pemicu gangguan stres pasca trauma antara lain:
Pengalaman yang menakutkan, termasuk jumlah dan tingkat keparahan trauma yang telah terjadi dalam hidup.
Mewarisi risiko kesehatan mental, riwayat gangguan kecemasan dan depresi dalam keluarga.
Ciri-ciri kepribadian seperti kecenderungan temperamental.
Cara otak mengatur bahan kimia dan hormon yang tubuh lepaskan sebagai respons terhadap stres.
PTSD bisa menyasar segala usia. Namun, beberapa faktor berikut dapat meningkatkan risiko seperti:
Mengalami trauma yang intens.
Pernah mengalami trauma lain pada awal kehidupan, seperti pelecehan pada masa kanak-kanak.
Memiliki pekerjaan yang meningkatkan risiko terkena peristiwa traumatis, seperti anggota militer.
Mempunyai masalah kesehatan mental lainnya, seperti kecemasan atau depresi.
Adanya masalah penyalahgunaan zat, seperti minum alkohol berlebihan atau penggunaan narkoba.
Memiliki anggota keluarga sedarah dengan masalah mental."
Gejala PTSD,"Kemunculan gejala sangat beragam. Gejala PTSD bisa saja muncul dalam 1 bulan hingga bertahun-tahun setelah mengalami kejadian traumatis. Gejala PTSD terbagi menjadi 4 tipe yaitu:
1. Gejala ingatan intrusif
Beberapa kondisi yang masuk dalam gejala ingatan intrusif, antara lain: 
Ingatan yang tidak diinginkan. Gejala bersifat mengganggu dan datang secara berulang.
Menghidupkan peristiwa traumatis seakan peristiwa tersebut terjadi lagi (kilas balik).
Mimpi buruk tentang peristiwa tersebut.
Respons terhadap peristiwa traumatis.
Selain itu, pengidap juga cenderung menghindari sesuatu. Ini termasuk menghindari pikiran dan obrolan tentang peristiwa traumatis maupun tempat, kegiatan, atau seseorang yang mengingatkan pada kejadian traumatis.
2. Perubahan negatif
Selanjutnya, gejala PTSD yang termasuk dalam perubahan negatif, antara lain:
Muncul pikiran negatif.
Putus asa tentang masa depan.
Kesulitan dalam mengingat.
Merasa jauh dari keluarga dan teman.
Kurangnya minat pada kegiatan yang disukai sebelumnya.
Tak ada emosi positif.
Mati rasa.
3. Perubahan reaksi emosional dan fisik 
Lalu, gejala yang mengarah pada perubahan reaksi emosi dan fisik, yaitu: 
Mudah kaget atau ketakutan.
Selalu waspada terhadap bahaya.
Perilaku merusak diri.
Kesulitan tidur.
Mengalami kesulitan berkonsentrasi.
Rasa bersalah atau malu yang luar biasa.
Meski bisa terjadi pada siapa saja, PTSD ternyata lebih berisiko terjadi pada usia remaja. Inilah mengapa, orang tua perlu mengetahui apa saja tandanya dan bagaimana cara menangani masalah ini. "
Diagnosis PTSD,"Guna mendapatkan diagnosis yang akurat, dokter akan melakukan serangkaian tes kepada pengidap. Pemeriksaan tersebut termasuk: 
Pemeriksaan fisik guna mengetahui masalah medis yang menyebabkan gejala.
Melakukan evaluasi psikologis, mencakup diskusi tentang tanda dan gejala yang mengarah pada peristiwa.
Menggunakan kriteria dalam Diagnostic and Statistical Manual of Mental Disorders (DSM-5) dari American Psychiatric Association sebagai acuan.
Seseorang bisa dikatakan mengalami PTSD apabila pernah mengalami peristiwa atau kondisi berikut ini sebelum munculnya gejala: 
Mengalami peristiwa yang sangat traumatis secara langsung.
Melihat peristiwa traumatis yang terjadi pada orang lain.
Mendapat kabar bahwa orang terdekat mengalami kejadian yang traumatis.
Terbayang akan peristiwa yang tidak menyenangkan atau memicu trauma berulang kali tanpa sadar. "
Pengobatan PTSD,"Penanganan atau pengobatan PTSD bisa berupa psikoterapi, pemberian obat, dan gabungan antara dua pilihan tersebut.
Dokter akan memberikan penanganan sesuai dengan gejala yang muncul, tingkat keparahan, riwayat penyakit, dan penyebab yang mendasarinya. 
1. Psikoterapi
Psikoterapi menjadi pilihan penanganan PTSD yang paling utama. Setidaknya, ada tiga macam terapi yang bisa menjadi pertimbangan, yaitu: 
Terapi kognitif. Jenis terapi bicara ini membantu pengidap mengenali cara berpikir (pola kognitif) yang membuatnya terjebak dalam ingatan masa lalu.
Terapi paparan. Terapi perilaku ini membantu pengidap menghadapi situasi dan ingatan yang menakutkan dengan aman.
Desensitisasi dan pemrosesan ulang gerakan mata. Terapi ini adalah gabungan antara pemaparan dengan gerakan mata untuk memproses ingatan traumatis dan mengubah cara bereaksi.
2. Obat
Selain itu, dokter juga bisa meresepkan obat untuk membantu menangani PTSD. Pilihan obatnya termasuk: 
Antidepresan. Dokter meresepkan obat ini untuk membantu gejala depresi, kecemasan, masalah tidur, dan konsentrasi.
Antikecemasan. Obat ini dapat meredakan kecemasan parah dan masalah terkait. Obat hanya digunakan dalam waktu singkat.
Prazosin. Obat ini bisa mengurangi atau menekan mimpi buruk pada pengidap."
